{
  "best_for": "Modern Vue 3 applications with Composition API and progressive enhancement features",
  "build_speed": "medium",
  "category": "ssg_template_business_service",
  "complexity_level": "medium_to_high",
  "display_name": "Nuxt.js",
  "ecosystem": "vue",
  "hosting_pattern": "aws_optimized",
  "key_features": [
    "vue_3_composition_api",
    "progressive_enhancement",
    "pinia_state_management",
    "modern_patterns",
    "vue_ecosystem"
  ],
  "language": "javascript",
  "last_updated": "2025-10-13T08:50:30.595139+00:00",
  "monthly_cost_range": [
    75,
    115
  ],
  "performance_tier": "optimized",
  "provider_name": "nuxt",
  "provider_type": "ssg",
  "schema_version": "1.0.0",
  "setup_cost_range": [
    1000,
    2500
  ],
  "ssg_engine": "nuxt",
  "target_market": [
    "developers",
    "technical_teams",
    "agencies"
  ],
  "tier_name": "Nuxt - Vue Ecosystem with Modern Patterns"
}