{
  "best_for": "Advanced features, subscriptions, complex workflows",
  "category": "ecommerce_tier_service",
  "complexity_level": "medium_to_high",
  "display_name": "Foxy",
  "ecommerce_type": "advanced_platform",
  "hosting_pattern": "aws_optimized",
  "key_features": [
    "subscription_management",
    "advanced_checkout",
    "webhook_automation",
    "complex_pricing"
  ],
  "last_updated": "2025-10-13T08:50:30.595139+00:00",
  "monthly_cost_range": [
    100,
    150
  ],
  "performance_tier": "optimized",
  "provider_name": "foxy",
  "provider_type": "ecommerce",
  "schema_version": "1.0.0",
  "setup_cost_range": [
    1200,
    3000
  ],
  "target_market": [
    "small_businesses",
    "agencies",
    "developers"
  ],
  "tier_name": "Foxy E-commerce - Advanced E-commerce Features"
}